22:38:12.567540 IP 172.17.1.149.45236 > 172.17.1.47.80: Flags [S], seq 2588040893, win 29200, options [mss 1460,sackOK,TS val 1620865244 ecr 0,nop,wscale 7], length 0
22:38:12.569284 IP 172.17.1.47.80 > 172.17.1.149.45236: Flags [S.], seq 838811196, ack 2588040894, win 65535, options [mss 1460], length 0
22:38:12.569347 IP 172.17.1.149.45236 > 172.17.1.47.80: Flags [.], ack 1, win 29200, length 0
22:38:12.569359 IP 172.17.1.149.45236 > 172.17.1.47.80: Flags [F.], seq 1, ack 1, win 29200, length 0
22:38:12.569701 IP 172.17.1.47.80 > 172.17.1.149.45236: Flags [.], ack 2, win 65534, length 0
22:38:12.570570 IP 172.17.1.47.80 > 172.17.1.149.45236: Flags [F.], seq 1, ack 2, win 65534, length 0
22:38:12.575349 IP 172.17.1.149.45236 > 172.17.1.47.80: Flags [.], ack 2, win 29200, length 0
22:38:12.577295 IP 172.17.1.149.45238 > 172.17.1.47.80: Flags [S], seq 2873093230, win 29200, options [mss 1460,sackOK,TS val 1620865263 ecr 0,nop,wscale 7], length 0
22:38:12.577607 IP 172.17.1.149.45240 > 172.17.1.47.80: Flags [S], seq 302716867, win 29200, options [mss 1460,sackOK,TS val 1620865263 ecr 0,nop,wscale 7], length 0
22:38:12.577622 IP 172.17.1.149.45242 > 172.17.1.47.80: Flags [S], seq 2309995956, win 29200, options [mss 1460,sackOK,TS val 1620865263 ecr 0,nop,wscale 7], length 0
22:38:12.577638 IP 172.17.1.149.45244 > 172.17.1.47.80: Flags [S], seq 1796826239, win 29200, options [mss 1460,sackOK,TS val 1620865263 ecr 0,nop,wscale 7], length 0
22:38:12.577653 IP 172.17.1.149.45246 > 172.17.1.47.80: Flags [S], seq 963021519, win 29200, options [mss 1460,sackOK,TS val 1620865263 ecr 0,nop,wscale 7], length 0
22:38:12.577662 IP 172.17.1.149.45248 > 172.17.1.47.80: Flags [S], seq 1897555598, win 29200, options [mss 1460,sackOK,TS val 1620865263 ecr 0,nop,wscale 7], length 0
22:38:12.577671 IP 172.17.1.149.45250 > 172.17.1.47.80: Flags [S], seq 305784017, win 29200, options [mss 1460,sackOK,TS val 1620865263 ecr 0,nop,wscale 7], length 0
22:38:12.577685 IP 172.17.1.149.45252 > 172.17.1.47.80: Flags [S], seq 811620423, win 29200, options [mss 1460,sackOK,TS val 1620865263 ecr 0,nop,wscale 7], length 0
22:38:12.577695 IP 172.17.1.149.45254 > 172.17.1.47.80: Flags [S], seq 4114313639, win 29200, options [mss 1460,sackOK,TS val 1620865263 ecr 0,nop,wscale 7], length 0
22:38:12.577744 IP 172.17.1.149.45256 > 172.17.1.47.80: Flags [S], seq 3624354931, win 29200, options [mss 1460,sackOK,TS val 1620865264 ecr 0,nop,wscale 7], length 0
22:38:12.577762 IP 172.17.1.149.45258 > 172.17.1.47.80: Flags [S], seq 756600341, win 29200, options [mss 1460,sackOK,TS val 1620865264 ecr 0,nop,wscale 7], length 0
22:38:12.577775 IP 172.17.1.149.45260 > 172.17.1.47.80: Flags [S], seq 195379881, win 29200, options [mss 1460,sackOK,TS val 1620865264 ecr 0,nop,wscale 7], length 0
22:38:12.577791 IP 172.17.1.149.45262 > 172.17.1.47.80: Flags [S], seq 144939515, win 29200, options [mss 1460,sackOK,TS val 1620865264 ecr 0,nop,wscale 7], length 0
22:38:12.577803 IP 172.17.1.149.45264 > 172.17.1.47.80: Flags [S], seq 4152036035, win 29200, options [mss 1460,sackOK,TS val 1620865264 ecr 0,nop,wscale 7], length 0
22:38:12.577813 IP 172.17.1.149.45266 > 172.17.1.47.80: Flags [S], seq 2796819117, win 29200, options [mss 1460,sackOK,TS val 1620865264 ecr 0,nop,wscale 7], length 0
22:38:12.577826 IP 172.17.1.149.45268 > 172.17.1.47.80: Flags [S], seq 3357853192, win 29200, options [mss 1460,sackOK,TS val 1620865264 ecr 0,nop,wscale 7], length 0
22:38:12.577839 IP 172.17.1.149.45270 > 172.17.1.47.80: Flags [S], seq 3272681375, win 29200, options [mss 1460,sackOK,TS val 1620865264 ecr 0,nop,wscale 7], length 0
22:38:12.577852 IP 172.17.1.149.45272 > 172.17.1.47.80: Flags [S], seq 2356587113, win 29200, options [mss 1460,sackOK,TS val 1620865264 ecr 0,nop,wscale 7], length 0
22:38:12.577863 IP 172.17.1.149.45274 > 172.17.1.47.80: Flags [S], seq 3295316681, win 29200, options [mss 1460,sackOK,TS val 1620865264 ecr 0,nop,wscale 7], length 0
22:38:12.577878 IP 172.17.1.149.45276 > 172.17.1.47.80: Flags [S], seq 365767704, win 29200, options [mss 1460,sackOK,TS val 1620865264 ecr 0,nop,wscale 7], length 0
22:38:12.577890 IP 172.17.1.149.45278 > 172.17.1.47.80: Flags [S], seq 64579540, win 29200, options [mss 1460,sackOK,TS val 1620865264 ecr 0,nop,wscale 7], length 0
22:38:12.577915 IP 172.17.1.149.45280 > 172.17.1.47.80: Flags [S], seq 793607416, win 29200, options [mss 1460,sackOK,TS val 1620865264 ecr 0,nop,wscale 7], length 0
22:38:12.577930 IP 172.17.1.149.45282 > 172.17.1.47.80: Flags [S], seq 2642625283, win 29200, options [mss 1460,sackOK,TS val 1620865264 ecr 0,nop,wscale 7], length 0
22:38:12.577942 IP 172.17.1.149.45284 > 172.17.1.47.80: Flags [S], seq 48009418, win 29200, options [mss 1460,sackOK,TS val 1620865264 ecr 0,nop,wscale 7], length 0
22:38:12.577964 IP 172.17.1.149.45286 > 172.17.1.47.80: Flags [S], seq 3433028408, win 29200, options [mss 1460,sackOK,TS val 1620865264 ecr 0,nop,wscale 7], length 0
22:38:12.577978 IP 172.17.1.149.45288 > 172.17.1.47.80: Flags [S], seq 3485525956, win 29200, options [mss 1460,sackOK,TS val 1620865264 ecr 0,nop,wscale 7], length 0
22:38:12.577989 IP 172.17.1.149.45290 > 172.17.1.47.80: Flags [S], seq 3841910492, win 29200, options [mss 1460,sackOK,TS val 1620865264 ecr 0,nop,wscale 7], length 0
22:38:12.578003 IP 172.17.1.149.45292 > 172.17.1.47.80: Flags [S], seq 2291015373, win 29200, options [mss 1460,sackOK,TS val 1620865264 ecr 0,nop,wscale 7], length 0
22:38:12.578012 IP 172.17.1.149.45294 > 172.17.1.47.80: Flags [S], seq 1528861383, win 29200, options [mss 1460,sackOK,TS val 1620865264 ecr 0,nop,wscale 7], length 0
22:38:12.578022 IP 172.17.1.149.45296 > 172.17.1.47.80: Flags [S], seq 2222356532, win 29200, options [mss 1460,sackOK,TS val 1620865264 ecr 0,nop,wscale 7], length 0
22:38:12.578032 IP 172.17.1.149.45298 > 172.17.1.47.80: Flags [S], seq 201964803, win 29200, options [mss 1460,sackOK,TS val 1620865264 ecr 0,nop,wscale 7], length 0
22:38:12.578038 IP 172.17.1.149.45300 > 172.17.1.47.80: Flags [S], seq 2942125405, win 29200, options [mss 1460,sackOK,TS val 1620865264 ecr 0,nop,wscale 7], length 0
22:38:12.578045 IP 172.17.1.47.80 > 172.17.1.149.45238: Flags [S.], seq 3137028121, ack 2873093231, win 65535, options [mss 1460], length 0
22:38:12.578052 IP 172.17.1.47.80 > 172.17.1.149.45242: Flags [S.], seq 2947978007, ack 2309995957, win 65535, options [mss 1460], length 0
22:38:12.578059 IP 172.17.1.47.80 > 172.17.1.149.45246: Flags [S.], seq 171578863, ack 963021520, win 65535, options [mss 1460], length 0
22:38:12.578067 IP 172.17.1.47.80 > 172.17.1.149.45250: Flags [S.], seq 1418420369, ack 305784018, win 65535, options [mss 1460], length 0
22:38:12.578079 IP 172.17.1.47.80 > 172.17.1.149.45254: Flags [S.], seq 3312309184, ack 4114313640, win 65535, options [mss 1460], length 0
22:38:12.578091 IP 172.17.1.47.80 > 172.17.1.149.45258: Flags [S.], seq 3497515417, ack 756600342, win 65535, options [mss 1460], length 0
22:38:12.578103 IP 172.17.1.47.80 > 172.17.1.149.45262: Flags [S.], seq 680637465, ack 144939516, win 65535, options [mss 1460], length 0
22:38:12.578128 IP 172.17.1.47.80 > 172.17.1.149.45266: Flags [S.], seq 2957281654, ack 2796819118, win 65535, options [mss 1460], length 0
22:38:12.578136 IP 172.17.1.47.80 > 172.17.1.149.45270: Flags [S.], seq 828206972, ack 3272681376, win 65535, options [mss 1460], length 0
22:38:12.578148 IP 172.17.1.47.80 > 172.17.1.149.45274: Flags [S.], seq 1239484493, ack 3295316682, win 65535, options [mss 1460], length 0
22:38:12.578158 IP 172.17.1.47.80 > 172.17.1.149.45278: Flags [S.], seq 3292768916, ack 64579541, win 65535, options [mss 1460], length 0
22:38:12.578171 IP 172.17.1.47.80 > 172.17.1.149.45282: Flags [S.], seq 284194596, ack 2642625284, win 65535, options [mss 1460], length 0
22:38:12.578181 IP 172.17.1.47.80 > 172.17.1.149.45286: Flags [S.], seq 2559541897, ack 3433028409, win 65535, options [mss 1460], length 0
22:38:12.578194 IP 172.17.1.47.80 > 172.17.1.149.45290: Flags [S.], seq 34031973, ack 3841910493, win 65535, options [mss 1460], length 0
22:38:12.578204 IP 172.17.1.47.80 > 172.17.1.149.45294: Flags [S.], seq 438982931, ack 1528861384, win 65535, options [mss 1460], length 0
22:38:12.578211 IP 172.17.1.47.80 > 172.17.1.149.45298: Flags [S.], seq 82793505, ack 201964804, win 65535, options [mss 1460], length 0
22:38:12.578219 IP 172.17.1.149.45302 > 172.17.1.47.80: Flags [S], seq 3064421488, win 29200, options [mss 1460,sackOK,TS val 1620865264 ecr 0,nop,wscale 7], length 0
22:38:12.578226 IP 172.17.1.149.45304 > 172.17.1.47.80: Flags [S], seq 670015881, win 29200, options [mss 1460,sackOK,TS val 1620865264 ecr 0,nop,wscale 7], length 0
22:38:12.578234 IP 172.17.1.149.45306 > 172.17.1.47.80: Flags [S], seq 1028826970, win 29200, options [mss 1460,sackOK,TS val 1620865264 ecr 0,nop,wscale 7], length 0
22:38:12.578241 IP 172.17.1.149.45308 > 172.17.1.47.80: Flags [S], seq 3230883104, win 29200, options [mss 1460,sackOK,TS val 1620865264 ecr 0,nop,wscale 7], length 0
22:38:12.578250 IP 172.17.1.149.45310 > 172.17.1.47.80: Flags [S], seq 173568410, win 29200, options [mss 1460,sackOK,TS val 1620865264 ecr 0,nop,wscale 7], length 0
22:38:12.579802 IP 172.17.1.149.45312 > 172.17.1.47.80: Flags [S], seq 2142955884, win 29200, options [mss 1460,sackOK,TS val 1620865264 ecr 0,nop,wscale 7], length 0
22:38:12.579860 IP 172.17.1.149.45314 > 172.17.1.47.80: Flags [S], seq 966748257, win 29200, options [mss 1460,sackOK,TS val 1620865264 ecr 0,nop,wscale 7], length 0
22:38:12.579875 IP 172.17.1.149.45316 > 172.17.1.47.80: Flags [S], seq 819220926, win 29200, options [mss 1460,sackOK,TS val 1620865264 ecr 0,nop,wscale 7], length 0
22:38:12.579908 IP 172.17.1.149.45318 > 172.17.1.47.80: Flags [S], seq 280860731, win 29200, options [mss 1460,sackOK,TS val 1620865264 ecr 0,nop,wscale 7], length 0
22:38:12.579923 IP 172.17.1.149.45320 > 172.17.1.47.80: Flags [S], seq 2676348597, win 29200, options [mss 1460,sackOK,TS val 1620865265 ecr 0,nop,wscale 7], length 0
22:38:12.579934 IP 172.17.1.149.45322 > 172.17.1.47.80: Flags [S], seq 2252405698, win 29200, options [mss 1460,sackOK,TS val 1620865265 ecr 0,nop,wscale 7], length 0
22:38:12.579952 IP 172.17.1.149.45324 > 172.17.1.47.80: Flags [S], seq 1023229119, win 29200, options [mss 1460,sackOK,TS val 1620865265 ecr 0,nop,wscale 7], length 0
22:38:12.579965 IP 172.17.1.149.45326 > 172.17.1.47.80: Flags [S], seq 1582915784, win 29200, options [mss 1460,sackOK,TS val 1620865265 ecr 0,nop,wscale 7], length 0
22:38:12.579979 IP 172.17.1.149.45328 > 172.17.1.47.80: Flags [S], seq 2147137919, win 29200, options [mss 1460,sackOK,TS val 1620865265 ecr 0,nop,wscale 7], length 0
22:38:12.579989 IP 172.17.1.149.45330 > 172.17.1.47.80: Flags [S], seq 2251579401, win 29200, options [mss 1460,sackOK,TS val 1620865265 ecr 0,nop,wscale 7], length 0
22:38:12.579998 IP 172.17.1.149.45332 > 172.17.1.47.80: Flags [S], seq 2295965245, win 29200, options [mss 1460,sackOK,TS val 1620865265 ecr 0,nop,wscale 7], length 0
22:38:12.580008 IP 172.17.1.149.45334 > 172.17.1.47.80: Flags [S], seq 1581994722, win 29200, options [mss 1460,sackOK,TS val 1620865265 ecr 0,nop,wscale 7], length 0
22:38:12.580020 IP 172.17.1.149.45336 > 172.17.1.47.80: Flags [S], seq 3327846236, win 29200, options [mss 1460,sackOK,TS val 1620865265 ecr 0,nop,wscale 7], length 0
22:38:12.580050 IP 172.17.1.149.45338 > 172.17.1.47.80: Flags [S], seq 4025152549, win 29200, options [mss 1460,sackOK,TS val 1620865265 ecr 0,nop,wscale 7], length 0
22:38:12.580060 IP 172.17.1.149.45340 > 172.17.1.47.80: Flags [S], seq 1277714992, win 29200, options [mss 1460,sackOK,TS val 1620865265 ecr 0,nop,wscale 7], length 0
22:38:12.580070 IP 172.17.1.47.80 > 172.17.1.149.45302: Flags [S.], seq 2600425128, ack 3064421489, win 65535, options [mss 1460], length 0
22:38:12.580079 IP 172.17.1.47.80 > 172.17.1.149.45306: Flags [S.], seq 2197944861, ack 1028826971, win 65535, options [mss 1460], length 0
22:38:12.580091 IP 172.17.1.47.80 > 172.17.1.149.45310: Flags [S.], seq 3620714386, ack 173568411, win 65535, options [mss 1460], length 0
22:38:12.580098 IP 172.17.1.47.80 > 172.17.1.149.45314: Flags [S.], seq 1537978140, ack 966748258, win 65535, options [mss 1460], length 0
22:38:12.580109 IP 172.17.1.47.80 > 172.17.1.149.45318: Flags [S.], seq 311692037, ack 280860732, win 65535, options [mss 1460], length 0
22:38:12.580116 IP 172.17.1.47.80 > 172.17.1.149.45322: Flags [S.], seq 735218729, ack 2252405699, win 65535, options [mss 1460], length 0
22:38:12.580123 IP 172.17.1.47.80 > 172.17.1.149.45326: Flags [S.], seq 3056361412, ack 1582915785, win 65535, options [mss 1460], length 0
22:38:12.580135 IP 172.17.1.47.80 > 172.17.1.149.45330: Flags [S.], seq 1258047542, ack 2251579402, win 65535, options [mss 1460], length 0
22:38:12.580147 IP 172.17.1.47.80 > 172.17.1.149.45334: Flags [S.], seq 2279777840, ack 1581994723, win 65535, options [mss 1460], length 0
22:38:12.580156 IP 172.17.1.47.80 > 172.17.1.149.45338: Flags [S.], seq 479813517, ack 4025152550, win 65535, options [mss 1460], length 0
22:38:12.580164 IP 172.17.1.149.45342 > 172.17.1.47.80: Flags [S], seq 2006122756, win 29200, options [mss 1460,sackOK,TS val 1620865265 ecr 0,nop,wscale 7], length 0
22:38:12.580175 IP 172.17.1.149.45246 > 172.17.1.47.80: Flags [.], ack 1, win 29200, length 0
22:38:12.580182 IP 172.17.1.149.45344 > 172.17.1.47.80: Flags [S], seq 799150095, win 29200, options [mss 1460,sackOK,TS val 1620865265 ecr 0,nop,wscale 7], length 0
22:38:12.580190 IP 172.17.1.47.80 > 172.17.1.149.45342: Flags [S.], seq 4137980488, ack 2006122757, win 65535, options [mss 1460], length 0
22:38:12.580199 IP 172.17.1.149.45242 > 172.17.1.47.80: Flags [.], ack 1, win 29200, length 0
22:38:12.583533 IP 172.17.1.149.45238 > 172.17.1.47.80: Flags [.], ack 1, win 29200, length 0
22:38:12.583546 IP 172.17.1.149.45250 > 172.17.1.47.80: Flags [.], ack 1, win 29200, length 0
22:38:12.583559 IP 172.17.1.149.45270 > 172.17.1.47.80: Flags [.], ack 1, win 29200, length 0
22:38:12.583566 IP 172.17.1.149.45254 > 172.17.1.47.80: Flags [.], ack 1, win 29200, length 0
22:38:12.583574 IP 172.17.1.149.45290 > 172.17.1.47.80: Flags [.], ack 1, win 29200, length 0
22:38:12.583580 IP 172.17.1.149.45258 > 172.17.1.47.80: Flags [.], ack 1, win 29200, length 0
22:38:12.583587 IP 172.17.1.149.45278 > 172.17.1.47.80: Flags [.], ack 1, win 29200, length 0
22:38:12.583594 IP 172.17.1.149.45302 > 172.17.1.47.80: Flags [.], ack 1, win 29200, length 0
22:38:12.583601 IP 172.17.1.149.45346 > 172.17.1.47.80: Flags [S], seq 2515435004, win 29200, options [mss 1460,sackOK,TS val 1620865265 ecr 0,nop,wscale 7], length 0
22:38:12.583625 IP 172.17.1.47.80 > 172.17.1.149.45346: Flags [S.], seq 2262984634, ack 2515435005, win 65535, options [mss 1460], length 0
22:38:12.583635 IP 172.17.1.149.45298 > 172.17.1.47.80: Flags [.], ack 1, win 29200, length 0
22:38:12.583642 IP 172.17.1.149.45310 > 172.17.1.47.80: Flags [.], ack 1, win 29200, length 0
22:38:12.583649 IP 172.17.1.149.45274 > 172.17.1.47.80: Flags [.], ack 1, win 29200, length 0
22:38:12.583655 IP 172.17.1.149.45330 > 172.17.1.47.80: Flags [.], ack 1, win 29200, length 0
22:38:12.583661 IP 172.17.1.149.45262 > 172.17.1.47.80: Flags [.], ack 1, win 29200, length 0
22:38:12.583668 IP 172.17.1.149.45326 > 172.17.1.47.80: Flags [.], ack 1, win 29200, length 0
22:38:12.583674 IP 172.17.1.149.45306 > 172.17.1.47.80: Flags [.], ack 1, win 29200, length 0
22:38:12.583680 IP 172.17.1.149.45282 > 172.17.1.47.80: Flags [.], ack 1, win 29200, length 0
22:38:12.583686 IP 172.17.1.149.45338 > 172.17.1.47.80: Flags [.], ack 1, win 29200, length 0
22:38:12.583693 IP 172.17.1.149.45322 > 172.17.1.47.80: Flags [.], ack 1, win 29200, length 0
22:38:12.583699 IP 172.17.1.149.45318 > 172.17.1.47.80: Flags [.], ack 1, win 29200, length 0
22:38:12.583711 IP 172.17.1.149.45294 > 172.17.1.47.80: Flags [.], ack 1, win 29200, length 0
22:38:12.583718 IP 172.17.1.149.45266 > 172.17.1.47.80: Flags [.], ack 1, win 29200, length 0
22:38:12.583726 IP 172.17.1.149.45286 > 172.17.1.47.80: Flags [.], ack 1, win 29200, length 0
22:38:12.583732 IP 172.17.1.149.45348 > 172.17.1.47.80: Flags [S], seq 823493514, win 29200, options [mss 1460,sackOK,TS val 1620865265 ecr 0,nop,wscale 7], length 0
22:38:12.583809 IP 172.17.1.149.45314 > 172.17.1.47.80: Flags [.], ack 1, win 29200, length 0
22:38:12.583820 IP 172.17.1.149.45350 > 172.17.1.47.80: Flags [S], seq 2506566513, win 29200, options [mss 1460,sackOK,TS val 1620865265 ecr 0,nop,wscale 7], length 0
22:38:12.583830 IP 172.17.1.149.45342 > 172.17.1.47.80: Flags [.], ack 1, win 29200, length 0
22:38:12.583836 IP 172.17.1.149.45346 > 172.17.1.47.80: Flags [.], ack 1, win 29200, length 0
22:38:12.583842 IP 172.17.1.149.45334 > 172.17.1.47.80: Flags [.], ack 1, win 29200, length 0
22:38:12.583848 IP 172.17.1.149.45352 > 172.17.1.47.80: Flags [S], seq 2027707866, win 29200, options [mss 1460,sackOK,TS val 1620865265 ecr 0,nop,wscale 7], length 0
22:38:12.583864 IP 172.17.1.149.45354 > 172.17.1.47.80: Flags [S], seq 792008566, win 29200, options [mss 1460,sackOK,TS val 1620865265 ecr 0,nop,wscale 7], length 0
22:38:12.583873 IP 172.17.1.47.80 > 172.17.1.149.45350: Flags [S.], seq 956372056, ack 2506566514, win 65535, options [mss 1460], length 0
22:38:12.583886 IP 172.17.1.47.80 > 172.17.1.149.45354: Flags [S.], seq 1664736786, ack 792008567, win 65535, options [mss 1460], length 0
22:38:12.583899 IP 172.17.1.149.45356 > 172.17.1.47.80: Flags [S], seq 2342925665, win 29200, options [mss 1460,sackOK,TS val 1620865265 ecr 0,nop,wscale 7], length 0
22:38:12.583921 IP 172.17.1.149.45358 > 172.17.1.47.80: Flags [S], seq 504701623, win 29200, options [mss 1460,sackOK,TS val 1620865265 ecr 0,nop,wscale 7], length 0
22:38:12.583933 IP 172.17.1.47.80 > 172.17.1.149.45358: Flags [S.], seq 973725500, ack 504701624, win 65535, options [mss 1460], length 0
22:38:12.583945 IP 172.17.1.149.45360 > 172.17.1.47.80: Flags [S], seq 2579569798, win 29200, options [mss 1460,sackOK,TS val 1620865265 ecr 0,nop,wscale 7], length 0
22:38:12.583959 IP 172.17.1.149.45362 > 172.17.1.47.80: Flags [S], seq 1524479507, win 29200, options [mss 1460,sackOK,TS val 1620865265 ecr 0,nop,wscale 7], length 0
22:38:12.583968 IP 172.17.1.47.80 > 172.17.1.149.45362: Flags [S.], seq 4145017225, ack 1524479508, win 65535, options [mss 1460], length 0
22:38:12.583979 IP 172.17.1.149.45350 > 172.17.1.47.80: Flags [.], ack 1, win 29200, length 0
22:38:12.583985 IP 172.17.1.149.45358 > 172.17.1.47.80: Flags [.], ack 1, win 29200, length 0
22:38:12.583995 IP 172.17.1.149.45364 > 172.17.1.47.80: Flags [S], seq 2142107178, win 29200, options [mss 1460,sackOK,TS val 1620865265 ecr 0,nop,wscale 7], length 0
22:38:12.584012 IP 172.17.1.149.45366 > 172.17.1.47.80: Flags [S], seq 3670947057, win 29200, options [mss 1460,sackOK,TS val 1620865265 ecr 0,nop,wscale 7], length 0
22:38:12.584022 IP 172.17.1.47.80 > 172.17.1.149.45366: Flags [S.], seq 1275174710, ack 3670947058, win 65535, options [mss 1460], length 0
22:38:12.584052 IP 172.17.1.149.45354 > 172.17.1.47.80: Flags [.], ack 1, win 29200, length 0
22:38:12.584059 IP 172.17.1.149.45368 > 172.17.1.47.80: Flags [S], seq 432692855, win 29200, options [mss 1460,sackOK,TS val 1620865265 ecr 0,nop,wscale 7], length 0
22:38:12.584071 IP 172.17.1.149.45362 > 172.17.1.47.80: Flags [.], ack 1, win 29200, length 0
22:38:12.584076 IP 172.17.1.149.45370 > 172.17.1.47.80: Flags [S], seq 1211557872, win 29200, options [mss 1460,sackOK,TS val 1620865265 ecr 0,nop,wscale 7], length 0
22:38:12.584086 IP 172.17.1.47.80 > 172.17.1.149.45370: Flags [S.], seq 70127653, ack 1211557873, win 65535, options [mss 1460], length 0
22:38:12.584093 IP 172.17.1.149.45372 > 172.17.1.47.80: Flags [S], seq 3324837645, win 29200, options [mss 1460,sackOK,TS val 1620865265 ecr 0,nop,wscale 7], length 0
22:38:12.584103 IP 172.17.1.149.45366 > 172.17.1.47.80: Flags [.], ack 1, win 29200, length 0
22:38:12.584109 IP 172.17.1.149.45374 > 172.17.1.47.80: Flags [S], seq 686493840, win 29200, options [mss 1460,sackOK,TS val 1620865265 ecr 0,nop,wscale 7], length 0
22:38:12.584117 IP 172.17.1.47.80 > 172.17.1.149.45374: Flags [S.], seq 364639480, ack 686493841, win 65535, options [mss 1460], length 0
22:38:12.584125 IP 172.17.1.149.45370 > 172.17.1.47.80: Flags [.], ack 1, win 29200, length 0
22:38:12.584131 IP 172.17.1.149.45376 > 172.17.1.47.80: Flags [S], seq 1866106728, win 29200, options [mss 1460,sackOK,TS val 1620865265 ecr 0,nop,wscale 7], length 0
22:38:12.584141 IP 172.17.1.149.45374 > 172.17.1.47.80: Flags [.], ack 1, win 29200, length 0
22:38:12.584147 IP 172.17.1.149.45378 > 172.17.1.47.80: Flags [S], seq 3655367266, win 29200, options [mss 1460,sackOK,TS val 1620865265 ecr 0,nop,wscale 7], length 0
22:38:12.584156 IP 172.17.1.47.80 > 172.17.1.149.45378: Flags [S.], seq 2142171102, ack 3655367267, win 65535, options [mss 1460], length 0
22:38:12.584163 IP 172.17.1.149.45380 > 172.17.1.47.80: Flags [S], seq 1451408619, win 29200, options [mss 1460,sackOK,TS val 1620865266 ecr 0,nop,wscale 7], length 0
22:38:12.584173 IP 172.17.1.149.45382 > 172.17.1.47.80: Flags [S], seq 839743602, win 29200, options [mss 1460,sackOK,TS val 1620865266 ecr 0,nop,wscale 7], length 0
22:38:12.584182 IP 172.17.1.47.80 > 172.17.1.149.45382: Flags [S.], seq 3540143460, ack 839743603, win 65535, options [mss 1460], length 0
22:38:12.584190 IP 172.17.1.149.45378 > 172.17.1.47.80: Flags [.], ack 1, win 29200, length 0
22:38:12.584196 IP 172.17.1.149.45384 > 172.17.1.47.80: Flags [S], seq 2928408332, win 29200, options [mss 1460,sackOK,TS val 1620865266 ecr 0,nop,wscale 7], length 0
22:38:12.584206 IP 172.17.1.149.45382 > 172.17.1.47.80: Flags [.], ack 1, win 29200, length 0
22:38:12.584213 IP 172.17.1.149.45386 > 172.17.1.47.80: Flags [S], seq 1281351871, win 29200, options [mss 1460,sackOK,TS val 1620865266 ecr 0,nop,wscale 7], length 0
22:38:12.584222 IP 172.17.1.47.80 > 172.17.1.149.45386: Flags [S.], seq 4123793447, ack 1281351872, win 65535, options [mss 1460], length 0
22:38:12.584229 IP 172.17.1.149.45388 > 172.17.1.47.80: Flags [S], seq 1978131873, win 29200, options [mss 1460,sackOK,TS val 1620865266 ecr 0,nop,wscale 7], length 0
22:38:12.584238 IP 172.17.1.149.45390 > 172.17.1.47.80: Flags [S], seq 1347536682, win 29200, options [mss 1460,sackOK,TS val 1620865266 ecr 0,nop,wscale 7], length 0
22:38:12.584248 IP 172.17.1.47.80 > 172.17.1.149.45390: Flags [S.], seq 2196783989, ack 1347536683, win 65535, options [mss 1460], length 0
22:38:12.584273 IP 172.17.1.149.45386 > 172.17.1.47.80: Flags [.], ack 1, win 29200, length 0
22:38:12.584279 IP 172.17.1.149.45392 > 172.17.1.47.80: Flags [S], seq 2309354533, win 29200, options [mss 1460,sackOK,TS val 1620865266 ecr 0,nop,wscale 7], length 0
22:38:12.584289 IP 172.17.1.149.45394 > 172.17.1.47.80: Flags [S], seq 3738844841, win 29200, options [mss 1460,sackOK,TS val 1620865266 ecr 0,nop,wscale 7], length 0
22:38:12.584299 IP 172.17.1.47.80 > 172.17.1.149.45394: Flags [S.], seq 138213826, ack 3738844842, win 65535, options [mss 1460], length 0
22:38:12.584307 IP 172.17.1.149.45390 > 172.17.1.47.80: Flags [.], ack 1, win 29200, length 0
22:38:12.584313 IP 172.17.1.149.45396 > 172.17.1.47.80: Flags [S], seq 1127705466, win 29200, options [mss 1460,sackOK,TS val 1620865266 ecr 0,nop,wscale 7], length 0
22:38:12.584323 IP 172.17.1.149.45398 > 172.17.1.47.80: Flags [S], seq 1365586854, win 29200, options [mss 1460,sackOK,TS val 1620865266 ecr 0,nop,wscale 7], length 0
22:38:12.584332 IP 172.17.1.149.45394 > 172.17.1.47.80: Flags [.], ack 1, win 29200, length 0
22:38:12.584345 IP 172.17.1.149.45400 > 172.17.1.47.80: Flags [S], seq 2732466159, win 29200, options [mss 1460,sackOK,TS val 1620865266 ecr 0,nop,wscale 7], length 0
22:38:12.584359 IP 172.17.1.149.45402 > 172.17.1.47.80: Flags [S], seq 766883751, win 29200, options [mss 1460,sackOK,TS val 1620865266 ecr 0,nop,wscale 7], length 0
22:38:12.584370 IP 172.17.1.149.45404 > 172.17.1.47.80: Flags [S], seq 3847721168, win 29200, options [mss 1460,sackOK,TS val 1620865266 ecr 0,nop,wscale 7], length 0
22:38:12.584380 IP 172.17.1.149.45406 > 172.17.1.47.80: Flags [S], seq 1145485119, win 29200, options [mss 1460,sackOK,TS val 1620865266 ecr 0,nop,wscale 7], length 0
22:38:12.584389 IP 172.17.1.149.45408 > 172.17.1.47.80: Flags [S], seq 1056276158, win 29200, options [mss 1460,sackOK,TS val 1620865266 ecr 0,nop,wscale 7], length 0
22:38:12.584399 IP 172.17.1.149.45410 > 172.17.1.47.80: Flags [S], seq 3694723955, win 29200, options [mss 1460,sackOK,TS val 1620865266 ecr 0,nop,wscale 7], length 0
22:38:12.584410 IP 172.17.1.149.45412 > 172.17.1.47.80: Flags [S], seq 3491417681, win 29200, options [mss 1460,sackOK,TS val 1620865266 ecr 0,nop,wscale 7], length 0
22:38:12.584419 IP 172.17.1.149.45414 > 172.17.1.47.80: Flags [S], seq 313257179, win 29200, options [mss 1460,sackOK,TS val 1620865266 ecr 0,nop,wscale 7], length 0
22:38:12.584429 IP 172.17.1.149.45416 > 172.17.1.47.80: Flags [S], seq 64114262, win 29200, options [mss 1460,sackOK,TS val 1620865266 ecr 0,nop,wscale 7], length 0
22:38:12.584439 IP 172.17.1.149.45418 > 172.17.1.47.80: Flags [S], seq 386657230, win 29200, options [mss 1460,sackOK,TS val 1620865266 ecr 0,nop,wscale 7], length 0
22:38:12.584449 IP 172.17.1.149.45420 > 172.17.1.47.80: Flags [S], seq 3345639864, win 29200, options [mss 1460,sackOK,TS val 1620865266 ecr 0,nop,wscale 7], length 0
22:38:12.584458 IP 172.17.1.47.80 > 172.17.1.149.45398: Flags [S.], seq 1231719460, ack 1365586855, win 65535, options [mss 1460], length 0
22:38:12.584466 IP 172.17.1.47.80 > 172.17.1.149.45402: Flags [S.], seq 2744900323, ack 766883752, win 65535, options [mss 1460], length 0
22:38:12.584478 IP 172.17.1.47.80 > 172.17.1.149.45406: Flags [S.], seq 1662659439, ack 1145485120, win 65535, options [mss 1460], length 0
22:38:12.584485 IP 172.17.1.47.80 > 172.17.1.149.45410: Flags [S.], seq 2446390416, ack 3694723956, win 65535, options [mss 1460], length 0
22:38:12.584493 IP 172.17.1.47.80 > 172.17.1.149.45414: Flags [S.], seq 3151236769, ack 313257180, win 65535, options [mss 1460], length 0
22:38:12.584500 IP 172.17.1.47.80 > 172.17.1.149.45418: Flags [S.], seq 199863679, ack 386657231, win 65535, options [mss 1460], length 0
22:38:12.584507 IP 172.17.1.149.45422 > 172.17.1.47.80: Flags [S], seq 3865089722, win 29200, options [mss 1460,sackOK,TS val 1620865266 ecr 0,nop,wscale 7], length 0
22:38:12.584517 IP 172.17.1.149.45424 > 172.17.1.47.80: Flags [S], seq 872539925, win 29200, options [mss 1460,sackOK,TS val 1620865266 ecr 0,nop,wscale 7], length 0
22:38:12.584527 IP 172.17.1.149.45426 > 172.17.1.47.80: Flags [S], seq 1571533591, win 29200, options [mss 1460,sackOK,TS val 1620865266 ecr 0,nop,wscale 7], length 0
22:38:12.584536 IP 172.17.1.47.80 > 172.17.1.149.45422: Flags [S.], seq 571568019, ack 3865089723, win 65535, options [mss 1460], length 0
22:38:12.584544 IP 172.17.1.47.80 > 172.17.1.149.45426: Flags [S.], seq 4044879717, ack 1571533592, win 65535, options [mss 1460], length 0
22:38:12.584551 IP 172.17.1.149.45428 > 172.17.1.47.80: Flags [S], seq 1332055013, win 29200, options [mss 1460,sackOK,TS val 1620865266 ecr 0,nop,wscale 7], length 0
22:38:12.584565 IP 172.17.1.149.45430 > 172.17.1.47.80: Flags [S], seq 3006962786, win 29200, options [mss 1460,sackOK,TS val 1620865266 ecr 0,nop,wscale 7], length 0
22:38:12.584576 IP 172.17.1.47.80 > 172.17.1.149.45430: Flags [S.], seq 451104719, ack 3006962787, win 65535, options [mss 1460], length 0
22:38:12.584583 IP 172.17.1.149.45402 > 172.17.1.47.80: Flags [.], ack 1, win 29200, length 0
22:38:12.584590 IP 172.17.1.149.45414 > 172.17.1.47.80: Flags [.], ack 1, win 29200, length 0
22:38:12.584595 IP 172.17.1.149.45426 > 172.17.1.47.80: Flags [.], ack 1, win 29200, length 0
22:38:12.584601 IP 172.17.1.149.45398 > 172.17.1.47.80: Flags [.], ack 1, win 29200, length 0
22:38:12.584607 IP 172.17.1.149.45422 > 172.17.1.47.80: Flags [.], ack 1, win 29200, length 0
22:38:12.584613 IP 172.17.1.149.45432 > 172.17.1.47.80: Flags [S], seq 1621151591, win 29200, options [mss 1460,sackOK,TS val 1620865266 ecr 0,nop,wscale 7], length 0
22:38:12.584626 IP 172.17.1.149.45410 > 172.17.1.47.80: Flags [.], ack 1, win 29200, length 0
22:38:12.584633 IP 172.17.1.149.45434 > 172.17.1.47.80: Flags [S], seq 3052311406, win 29200, options [mss 1460,sackOK,TS val 1620865266 ecr 0,nop,wscale 7], length 0
22:38:12.584642 IP 172.17.1.47.80 > 172.17.1.149.45434: Flags [S.], seq 1529539413, ack 3052311407, win 65535, options [mss 1460], length 0
22:38:12.584650 IP 172.17.1.149.45430 > 172.17.1.47.80: Flags [.], ack 1, win 29200, length 0
22:38:12.585346 IP 172.17.1.149.45436 > 172.17.1.47.80: Flags [S], seq 2471835470, win 29200, options [mss 1460,sackOK,TS val 1620865266 ecr 0,nop,wscale 7], length 0
22:38:12.585377 IP 172.17.1.149.45438 > 172.17.1.47.80: Flags [S], seq 3084691706, win 29200, options [mss 1460,sackOK,TS val 1620865266 ecr 0,nop,wscale 7], length 0
22:38:12.585395 IP 172.17.1.47.80 > 172.17.1.149.45438: Flags [S.], seq 1183912603, ack 3084691707, win 65535, options [mss 1460], length 0
22:38:12.585404 IP 172.17.1.149.45434 > 172.17.1.47.80: Flags [.], ack 1, win 29200, length 0
22:38:12.585411 IP 172.17.1.149.45406 > 172.17.1.47.80: Flags [.], ack 1, win 29200, length 0
22:38:12.585417 IP 172.17.1.149.45440 > 172.17.1.47.80: Flags [S], seq 871605245, win 29200, options [mss 1460,sackOK,TS val 1620865266 ecr 0,nop,wscale 7], length 0
22:38:12.585427 IP 172.17.1.149.45418 > 172.17.1.47.80: Flags [.], ack 1, win 29200, length 0
22:38:12.585433 IP 172.17.1.149.45442 > 172.17.1.47.80: Flags [S], seq 1007444696, win 29200, options [mss 1460,sackOK,TS val 1620865266 ecr 0,nop,wscale 7], length 0
22:38:12.585443 IP 172.17.1.47.80 > 172.17.1.149.45442: Flags [S.], seq 1352250358, ack 1007444697, win 65535, options [mss 1460], length 0
22:38:12.585452 IP 172.17.1.149.45438 > 172.17.1.47.80: Flags [.], ack 1, win 29200, length 0
22:38:12.585457 IP 172.17.1.149.45444 > 172.17.1.47.80: Flags [S], seq 2938772791, win 29200, options [mss 1460,sackOK,TS val 1620865266 ecr 0,nop,wscale 7], length 0
22:38:12.585468 IP 172.17.1.149.45442 > 172.17.1.47.80: Flags [.], ack 1, win 29200, length 0
22:38:12.585473 IP 172.17.1.149.45446 > 172.17.1.47.80: Flags [S], seq 286739517, win 29200, options [mss 1460,sackOK,TS val 1620865266 ecr 0,nop,wscale 7], length 0
22:38:12.585483 IP 172.17.1.47.80 > 172.17.1.149.45446: Flags [S.], seq 2056784824, ack 286739518, win 65535, options [mss 1460], length 0
22:38:12.585491 IP 172.17.1.47.80 > 172.17.1.149.45240: Flags [S.], seq 4228088702, ack 302716868, win 65535, options [mss 1460], length 0
22:38:12.585499 IP 172.17.1.149.45448 > 172.17.1.47.80: Flags [S], seq 309987310, win 29200, options [mss 1460,sackOK,TS val 1620865267 ecr 0,nop,wscale 7], length 0
22:38:12.585509 IP 172.17.1.47.80 > 172.17.1.149.45244: Flags [S.], seq 480083382, ack 1796826240, win 65535, options [mss 1460], length 0
22:38:12.585517 IP 172.17.1.47.80 > 172.17.1.149.45248: Flags [S.], seq 1671452518, ack 1897555599, win 65535, options [mss 1460], length 0
22:38:12.585524 IP 172.17.1.47.80 > 172.17.1.149.45252: Flags [S.], seq 621963990, ack 811620424, win 65535, options [mss 1460], length 0
22:38:12.585533 IP 172.17.1.149.45450 > 172.17.1.47.80: Flags [S], seq 2904941738, win 29200, options [mss 1460,sackOK,TS val 1620865267 ecr 0,nop,wscale 7], length 0
22:38:12.585543 IP 172.17.1.47.80 > 172.17.1.149.45450: Flags [S.], seq 4255308275, ack 2904941739, win 65535, options [mss 1460], length 0
22:38:12.585550 IP 172.17.1.47.80 > 172.17.1.149.45256: Flags [S.], seq 1432686534, ack 3624354932, win 65535, options [mss 1460], length 0
22:38:12.585558 IP 172.17.1.47.80 > 172.17.1.149.45260: Flags [S.], seq 3639656094, ack 195379882, win 65535, options [mss 1460], length 0
22:38:12.585567 IP 172.17.1.149.45446 > 172.17.1.47.80: Flags [.], ack 1, win 29200, length 0
22:38:12.585983 IP 172.17.1.47.80 > 172.17.1.149.45264: Flags [S.], seq 2886427704, ack 4152036036, win 65535, options [mss 1460], length 0
22:38:12.585994 IP 172.17.1.47.80 > 172.17.1.149.45268: Flags [S.], seq 9804367, ack 3357853193, win 65535, options [mss 1460], length 0
22:38:12.586002 IP 172.17.1.47.80 > 172.17.1.149.45272: Flags [S.], seq 558921877, ack 2356587114, win 65535, options [mss 1460], length 0
22:38:12.586015 IP 172.17.1.47.80 > 172.17.1.149.45276: Flags [S.], seq 2882458334, ack 365767705, win 65535, options [mss 1460], length 0
22:38:12.586024 IP 172.17.1.47.80 > 172.17.1.149.45280: Flags [S.], seq 2423509964, ack 793607417, win 65535, options [mss 1460], length 0
22:38:12.586042 IP 172.17.1.47.80 > 172.17.1.149.45284: Flags [S.], seq 2518159311, ack 48009419, win 65535, options [mss 1460], length 0
22:38:12.586050 IP 172.17.1.47.80 > 172.17.1.149.45288: Flags [S.], seq 2617704249, ack 3485525957, win 65535, options [mss 1460], length 0
22:38:12.586057 IP 172.17.1.47.80 > 172.17.1.149.45292: Flags [S.], seq 2436479088, ack 2291015374, win 65535, options [mss 1460], length 0
22:38:12.586076 IP 172.17.1.149.45452 > 172.17.1.47.80: Flags [S], seq 2678296278, win 29200, options [mss 1460,sackOK,TS val 1620865267 ecr 0,nop,wscale 7], length 0
22:38:12.586087 IP 172.17.1.47.80 > 172.17.1.149.45296: Flags [S.], seq 2263645742, ack 2222356533, win 65535, options [mss 1460], length 0
22:38:12.586094 IP 172.17.1.47.80 > 172.17.1.149.45300: Flags [S.], seq 4282345664, ack 2942125406, win 65535, options [mss 1460], length 0
22:38:12.586102 IP 172.17.1.47.80 > 172.17.1.149.45304: Flags [S.], seq 261074823, ack 670015882, win 65535, options [mss 1460], length 0
22:38:12.586110 IP 172.17.1.47.80 > 172.17.1.149.45308: Flags [S.], seq 232794218, ack 3230883105, win 65535, options [mss 1460], length 0
22:38:12.586125 IP 172.17.1.149.45240 > 172.17.1.47.80: Flags [.], ack 1, win 29200, length 0
22:38:12.586131 IP 172.17.1.47.80 > 172.17.1.149.45312: Flags [S.], seq 1767666791, ack 2142955885, win 65535, options [mss 1460], length 0
22:38:12.586139 IP 172.17.1.47.80 > 172.17.1.149.45316: Flags [S.], seq 402680702, ack 819220927, win 65535, options [mss 1460], length 0
22:38:12.586147 IP 172.17.1.47.80 > 172.17.1.149.45320: Flags [S.], seq 2045288067, ack 2676348598, win 65535, options [mss 1460], length 0
22:38:12.586159 IP 172.17.1.47.80 > 172.17.1.149.45324: Flags [S.], seq 3441238414, ack 1023229120, win 65535, options [mss 1460], length 0
22:38:12.586167 IP 172.17.1.47.80 > 172.17.1.149.45328: Flags [S.], seq 159544567, ack 2147137920, win 65535, options [mss 1460], length 0
22:38:12.586175 IP 172.17.1.47.80 > 172.17.1.149.45332: Flags [S.], seq 3237944185, ack 2295965246, win 65535, options [mss 1460], length 0
22:38:12.586182 IP 172.17.1.47.80 > 172.17.1.149.45336: Flags [S.], seq 2604067869, ack 3327846237, win 65535, options [mss 1460], length 0
22:38:12.586190 IP 172.17.1.47.80 > 172.17.1.149.45340: Flags [S.], seq 402603988, ack 1277714993, win 65535, options [mss 1460], length 0
22:38:12.586198 IP 172.17.1.149.45252 > 172.17.1.47.80: Flags [.], ack 1, win 29200, length 0
22:38:12.586204 IP 172.17.1.47.80 > 172.17.1.149.45344: Flags [S.], seq 3064058934, ack 799150096, win 65535, options [mss 1460], length 0
22:38:12.586212 IP 172.17.1.47.80 > 172.17.1.149.45348: Flags [S.], seq 2073586689, ack 823493515, win 65535, options [mss 1460], length 0
22:38:12.586219 IP 172.17.1.149.45454 > 172.17.1.47.80: Flags [S], seq 3254780879, win 29200, options [mss 1460,sackOK,TS val 1620865267 ecr 0,nop,wscale 7], length 0
22:38:13.586230 IP 172.17.1.47.80 > 172.17.1.149.45352: Flags [S.], seq 2284998960, ack 2027707867, win 65535, options [mss 1460], length 0
22:38:12.586238 IP 172.17.1.47.80 > 172.17.1.149.45454: Flags [S.], seq 4231735058, ack 3254780880, win 65535, options [mss 1460], length 0
22:38:12.586245 IP 172.17.1.47.80 > 172.17.1.149.45356: Flags [S.], seq 3194076896, ack 2342925666, win 65535, options [mss 1460], length 0
22:38:12.586253 IP 172.17.1.149.45456 > 172.17.1.47.80: Flags [S], seq 3989981571, win 29200, options [mss 1460,sackOK,TS val 1620865267 ecr 0,nop,wscale 7], length 0
22:38:12.586263 IP 172.17.1.149.45256 > 172.17.1.47.80: Flags [.], ack 1, win 29200, length 0
22:38:12.586269 IP 172.17.1.47.80 > 172.17.1.149.45360: Flags [S.], seq 3482364036, ack 2579569799, win 65535, options [mss 1460], length 0
22:38:12.586282 IP 172.17.1.149.45260 > 172.17.1.47.80: Flags [.], ack 1, win 29200, length 0
22:38:12.586289 IP 172.17.1.47.80 > 172.17.1.149.45364: Flags [S.], seq 1624836385, ack 2142107179, win 65535, options [mss 1460], length 0
22:38:12.586297 IP 172.17.1.47.80 > 172.17.1.149.45368: Flags [S.], seq 2305528572, ack 432692856, win 65535, options [mss 1460], length 0
22:38:12.586305 IP 172.17.1.47.80 > 172.17.1.149.45372: Flags [S.], seq 1371157469, ack 3324837646, win 65535, options [mss 1460], length 0
22:38:12.586312 IP 172.17.1.149.45268 > 172.17.1.47.80: Flags [.], ack 1, win 29200, length 0
22:38:12.586318 IP 172.17.1.47.80 > 172.17.1.149.45376: Flags [S.], seq 2773767079, ack 1866106729, win 65535, options [mss 1460], length 0
22:38:12.586326 IP 172.17.1.149.45458 > 172.17.1.47.80: Flags [S], seq 3242236297, win 29200, options [mss 1460,sackOK,TS val 1620865267 ecr 0,nop,wscale 7], length 0
22:38:12.586336 IP 172.17.1.47.80 > 172.17.1.149.45380: Flags [S.], seq 3998922523, ack 1451408620, win 65535, options [mss 1460], length 0
22:38:12.586344 IP 172.17.1.47.80 > 172.17.1.149.45458: Flags [S.], seq 3187457615, ack 3242236298, win 65535, options [mss 1460], length 0
22:38:12.586353 IP 172.17.1.47.80 > 172.17.1.149.45384: Flags [S.], seq 3130440911, ack 2928408333, win 65535, options [mss 1460], length 0
22:38:12.586361 IP 172.17.1.47.80 > 172.17.1.149.45388: Flags [S.], seq 518099747, ack 1978131874, win 65535, options [mss 1460], length 0
22:38:12.586372 IP 172.17.1.47.80 > 172.17.1.149.45392: Flags [S.], seq 2127464589, ack 2309354534, win 65535, options [mss 1460], length 0
22:38:12.586381 IP 172.17.1.47.80 > 172.17.1.149.45396: Flags [S.], seq 1266192500, ack 1127705467, win 65535, options [mss 1460], length 0
22:38:12.586389 IP 172.17.1.47.80 > 172.17.1.149.45400: Flags [S.], seq 207398244, ack 2732466160, win 65535, options [mss 1460], length 0
22:38:12.586400 IP 172.17.1.149.45280 > 172.17.1.47.80: Flags [.], ack 1, win 29200, length 0
22:38:12.586411 IP 172.17.1.149.45308 > 172.17.1.47.80: Flags [.], ack 1, win 29200, length 0
22:38:12.586417 IP 172.17.1.47.80 > 172.17.1.149.45404: Flags [S.], seq 1967157747, ack 3847721169, win 65535, options [mss 1460], length 0
22:38:12.586424 IP 172.17.1.47.80 > 172.17.1.149.45408: Flags [S.], seq 2483024668, ack 1056276159, win 65535, options [mss 1460], length 0
22:38:12.586432 IP 172.17.1.47.80 > 172.17.1.149.45412: Flags [S.], seq 287812171, ack 3491417682, win 65535, options [mss 1460], length 0
22:38:12.586440 IP 172.17.1.47.80 > 172.17.1.149.45416: Flags [S.], seq 1764321116, ack 64114263, win 65535, options [mss 1460], length 0
22:38:12.586447 IP 172.17.1.47.80 > 172.17.1.149.45420: Flags [S.], seq 655373864, ack 3345639865, win 65535, options [mss 1460], length 0
22:38:12.586456 IP 172.17.1.47.80 > 172.17.1.149.45424: Flags [S.], seq 1689115973, ack 872539926, win 65535, options [mss 1460], length 0
22:38:12.586468 IP 172.17.1.149.45296 > 172.17.1.47.80: Flags [.], ack 1, win 29200, length 0
22:38:12.586475 IP 172.17.1.149.45336 > 172.17.1.47.80: Flags [.], ack 1, win 29200, length 0
22:38:12.586481 IP 172.17.1.149.45450 > 172.17.1.47.80: Flags [.], ack 1, win 29200, length 0
22:38:12.587653 IP 172.17.1.47.80 > 172.17.1.149.45428: Flags [S.], seq 2353965265, ack 1332055014, win 65535, options [mss 1460], length 0
22:38:12.587673 IP 172.17.1.47.80 > 172.17.1.149.45432: Flags [S.], seq 1800151273, ack 1621151592, win 65535, options [mss 1460], length 0
22:38:12.587681 IP 172.17.1.47.80 > 172.17.1.149.45436: Flags [S.], seq 3258699246, ack 2471835471, win 65535, options [mss 1460], leng

[END] 25.5.7 22:38:19